{
  "schemaVersion": "1.0.0",
  "corpusVersion": "v0.3.0-alpha.1",
  "description": "Sanitized synthetic outputs for the deterministic offline interview quality gate.",
  "requiredCoverage": {
    "modes": ["knowledge", "projects", "mixed"],
    "seniorities": ["junior", "mid", "senior"]
  },
  "thresholds": {
    "maxDuplicateQuestionRate": 0,
    "minEvidenceValidityRate": 1,
    "minModeCoverageRate": 1,
    "minSeniorityCoverageRate": 1,
    "minModeSeniorityCoverageRate": 1,
    "minModeConformanceRate": 1,
    "maxPrivacyMarkerHits": 0
  },
  "cases": [
    {
      "id": "knowledge-junior",
      "title": "Junior backend fundamentals",
      "mode": "knowledge",
      "seniority": "junior",
      "evidenceCatalog": [
        { "id": "k-jr-http", "kind": "knowledge", "label": "HTTP request lifecycle" },
        { "id": "k-jr-sql", "kind": "knowledge", "label": "SQL index fundamentals" }
      ],
      "privateMarkers": ["SYNTH_PRIVATE_KNOWLEDGE_JUNIOR"],
      "questions": [
        { "id": "q-kj-1", "text": "What happens between an HTTP client sending a request and a Go handler receiving it?", "kind": "knowledge", "difficulty": "easy", "evidenceRefIds": ["k-jr-http"] },
        { "id": "q-kj-2", "text": "Why can a database index speed up reads while making writes more expensive?", "kind": "knowledge", "difficulty": "easy", "evidenceRefIds": ["k-jr-sql"] },
        { "id": "q-kj-3", "text": "Which measurements would you collect before deciding that an endpoint needs caching?", "kind": "follow_up", "difficulty": "medium", "evidenceRefIds": ["k-jr-http"] }
      ],
      "publicTexts": [
        { "id": "summary-kj", "text": "The interview checks foundational request handling and data access reasoning." }
      ]
    },
    {
      "id": "knowledge-mid",
      "title": "Mid-level reliability knowledge",
      "mode": "knowledge",
      "seniority": "mid",
      "evidenceCatalog": [
        { "id": "k-mid-idempotency", "kind": "knowledge", "label": "Idempotent command processing" },
        { "id": "k-mid-cache", "kind": "knowledge", "label": "Cache consistency" }
      ],
      "privateMarkers": ["SYNTH_PRIVATE_KNOWLEDGE_MID"],
      "questions": [
        { "id": "q-km-1", "text": "How would you make a payment command idempotent across client retries?", "kind": "knowledge", "difficulty": "medium", "evidenceRefIds": ["k-mid-idempotency"] },
        { "id": "q-km-2", "text": "Compare cache-aside and write-through strategies when stale reads are costly.", "kind": "knowledge", "difficulty": "medium", "evidenceRefIds": ["k-mid-cache"] },
        { "id": "q-km-3", "text": "What failure would still remain after adding an idempotency key, and how would you observe it?", "kind": "follow_up", "difficulty": "hard", "evidenceRefIds": ["k-mid-idempotency"] }
      ],
      "publicTexts": [
        { "id": "summary-km", "text": "The interview focuses on retry safety and consistency tradeoffs." }
      ]
    },
    {
      "id": "knowledge-senior",
      "title": "Senior distributed systems knowledge",
      "mode": "knowledge",
      "seniority": "senior",
      "evidenceCatalog": [
        { "id": "k-sr-consensus", "kind": "knowledge", "label": "Consensus and quorum behavior" },
        { "id": "k-sr-backpressure", "kind": "knowledge", "label": "Backpressure and overload control" }
      ],
      "privateMarkers": ["SYNTH_PRIVATE_KNOWLEDGE_SENIOR"],
      "questions": [
        { "id": "q-ks-1", "text": "Under which network failures can a quorum write remain available, and what consistency does it provide?", "kind": "knowledge", "difficulty": "hard", "evidenceRefIds": ["k-sr-consensus"] },
        { "id": "q-ks-2", "text": "Design an overload-control policy that protects dependencies without hiding sustained capacity deficits.", "kind": "knowledge", "difficulty": "hard", "evidenceRefIds": ["k-sr-backpressure"] },
        { "id": "q-ks-3", "text": "How would you prove that retries are amplifying an incident rather than helping recovery?", "kind": "follow_up", "difficulty": "hard", "evidenceRefIds": ["k-sr-backpressure"] }
      ],
      "publicTexts": [
        { "id": "summary-ks", "text": "The interview probes distributed failure reasoning and operational safeguards." }
      ]
    },
    {
      "id": "projects-junior",
      "title": "Junior project walkthrough",
      "mode": "projects",
      "seniority": "junior",
      "evidenceCatalog": [
        { "id": "r-jr-api", "kind": "resume", "label": "Synthetic task API project" },
        { "id": "jd-jr-tests", "kind": "jd", "label": "Role requires automated testing" }
      ],
      "privateMarkers": ["SYNTH_PRIVATE_PROJECTS_JUNIOR"],
      "questions": [
        { "id": "q-pj-1", "text": "Walk through one endpoint you owned in the task API and explain your exact contribution.", "kind": "project", "difficulty": "easy", "evidenceRefIds": ["r-jr-api"] },
        { "id": "q-pj-2", "text": "Which test caught the most useful defect in that project, and why was it valuable?", "kind": "behavioral", "difficulty": "medium", "evidenceRefIds": ["r-jr-api", "jd-jr-tests"] },
        { "id": "q-pj-3", "text": "What evidence would distinguish your work from the rest of the team's implementation?", "kind": "follow_up", "difficulty": "medium", "evidenceRefIds": ["r-jr-api"] }
      ],
      "publicTexts": [
        { "id": "summary-pj", "text": "The interview verifies ownership and testing in a small backend project." }
      ]
    },
    {
      "id": "projects-mid",
      "title": "Mid-level service migration",
      "mode": "projects",
      "seniority": "mid",
      "evidenceCatalog": [
        { "id": "r-mid-migration", "kind": "resume", "label": "Synthetic service migration project" },
        { "id": "jd-mid-observe", "kind": "jd", "label": "Role requires observability ownership" }
      ],
      "privateMarkers": ["SYNTH_PRIVATE_PROJECTS_MID"],
      "questions": [
        { "id": "q-pm-1", "text": "Describe the migration boundary you chose and the constraint that most shaped it.", "kind": "project", "difficulty": "medium", "evidenceRefIds": ["r-mid-migration"] },
        { "id": "q-pm-2", "text": "Which production signal determined whether you continued or rolled back the migration?", "kind": "project", "difficulty": "hard", "evidenceRefIds": ["r-mid-migration", "jd-mid-observe"] },
        { "id": "q-pm-3", "text": "Tell me about a migration assumption that proved wrong and how you corrected it.", "kind": "behavioral", "difficulty": "hard", "evidenceRefIds": ["r-mid-migration"] }
      ],
      "publicTexts": [
        { "id": "summary-pm", "text": "The interview checks migration decisions, rollback evidence, and learning." }
      ]
    },
    {
      "id": "projects-senior",
      "title": "Senior platform leadership",
      "mode": "projects",
      "seniority": "senior",
      "evidenceCatalog": [
        { "id": "r-sr-platform", "kind": "resume", "label": "Synthetic multi-team platform program" },
        { "id": "jd-sr-strategy", "kind": "jd", "label": "Role requires technical strategy" }
      ],
      "privateMarkers": ["SYNTH_PRIVATE_PROJECTS_SENIOR"],
      "questions": [
        { "id": "q-ps-1", "text": "Which platform decision created the largest organizational tradeoff, and who disagreed with it?", "kind": "project", "difficulty": "hard", "evidenceRefIds": ["r-sr-platform", "jd-sr-strategy"] },
        { "id": "q-ps-2", "text": "How did you attribute business or engineering outcomes to the platform rather than adjacent initiatives?", "kind": "project", "difficulty": "hard", "evidenceRefIds": ["r-sr-platform"] },
        { "id": "q-ps-3", "text": "Describe a point where you changed strategy after receiving evidence from another team.", "kind": "behavioral", "difficulty": "hard", "evidenceRefIds": ["r-sr-platform", "jd-sr-strategy"] }
      ],
      "publicTexts": [
        { "id": "summary-ps", "text": "The interview tests strategic ownership, attribution, and cross-team judgment." }
      ]
    },
    {
      "id": "mixed-junior",
      "title": "Junior full-stack mixed interview",
      "mode": "mixed",
      "seniority": "junior",
      "evidenceCatalog": [
        { "id": "r-mj-dashboard", "kind": "resume", "label": "Synthetic dashboard project" },
        { "id": "k-mj-browser", "kind": "knowledge", "label": "Browser rendering fundamentals" },
        { "id": "jd-mj-access", "kind": "jd", "label": "Role requires accessible interfaces" }
      ],
      "privateMarkers": ["SYNTH_PRIVATE_MIXED_JUNIOR"],
      "questions": [
        { "id": "q-mj-1", "text": "Explain the browser work that occurs after your dashboard receives JSON data.", "kind": "knowledge", "difficulty": "easy", "evidenceRefIds": ["k-mj-browser"] },
        { "id": "q-mj-2", "text": "Show how you made one interactive dashboard control usable without a mouse.", "kind": "project", "difficulty": "medium", "evidenceRefIds": ["r-mj-dashboard", "jd-mj-access"] },
        { "id": "q-mj-3", "text": "What would you measure to confirm that the accessibility change helped users?", "kind": "follow_up", "difficulty": "medium", "evidenceRefIds": ["jd-mj-access"] }
      ],
      "publicTexts": [
        { "id": "summary-mj", "text": "The interview connects browser fundamentals to accessible project delivery." }
      ]
    },
    {
      "id": "mixed-mid",
      "title": "Mid-level data service mixed interview",
      "mode": "mixed",
      "seniority": "mid",
      "evidenceCatalog": [
        { "id": "r-mm-pipeline", "kind": "resume", "label": "Synthetic event pipeline project" },
        { "id": "k-mm-delivery", "kind": "knowledge", "label": "Event delivery semantics" },
        { "id": "jd-mm-slo", "kind": "jd", "label": "Role requires SLO ownership" }
      ],
      "privateMarkers": ["SYNTH_PRIVATE_MIXED_MID"],
      "questions": [